{
  "$schema": "https://json-schema.org/draft/2020-12/schema",
  "$id": "https://raw.githubusercontent.com/redact-secret/redact-secret-adapters/main/site-feed/v1/adapters.schema.json",
  "title": "Redact Secret adapter release feed, v1",
  "description": "What redact-secret-adapters declares it ships, per package: registry name, version, channel, and the core, host and runtime ranges CI qualifies, with the endpoints it tests. Generated by scripts/generate-site-feed.mjs from the release plan, the package manifests and compatibility.json; never edited by hand. A breaking change to this shape ships as site-feed/v2/ with a new schemaVersion, and v1 keeps its meaning. See RELEASING.md § The site release feed.",
  "type": "object",
  "additionalProperties": false,
  "required": ["schemaVersion", "generatedAt", "repository", "sources", "packages"],
  "properties": {
    "schemaVersion": {
      "const": "redact-secret-adapters.release-feed/v1",
      "description": "A consumer that does not recognise this value must refuse the feed."
    },
    "generatedAt": {
      "type": "string",
      "pattern": "^\\d{4}-\\d{2}-\\d{2}T00:00:00Z$",
      "description": "Derived from the inputs, never from a wall clock: compatibility.json's endpointsResolvedAt, at midnight UTC. The same inputs always produce the same value. The revision is the commit the consumer fetched the feed at."
    },
    "repository": { "const": "https://github.com/redact-secret/redact-secret-adapters" },
    "sources": {
      "description": "Repository-relative paths of the files the feed was generated from, at the same commit.",
      "type": "array",
      "minItems": 1,
      "uniqueItems": true,
      "items": { "type": "string", "pattern": "^[A-Za-z0-9._/-]+$" }
    },
    "packages": {
      "description": "Every package the release process publishes, in release-plan order. A package that is not released (private, unwired) is absent.",
      "type": "array",
      "minItems": 1,
      "items": { "$ref": "#/$defs/package" }
    }
  },
  "$defs": {
    "tested": {
      "description": "The two versions of a range CI installs and runs the real-host tests against. A version between them is inside the range but is not itself tested.",
      "type": "object",
      "additionalProperties": false,
      "required": ["lowest", "highest"],
      "properties": {
        "lowest": { "type": "string", "minLength": 1 },
        "highest": { "type": "string", "minLength": 1 }
      }
    },
    "requirement": {
      "type": "object",
      "additionalProperties": false,
      "required": ["name", "range", "kind", "optional", "tested"],
      "properties": {
        "name": { "type": "string", "minLength": 1 },
        "range": {
          "type": "string",
          "minLength": 1,
          "description": "The range exactly as the package manifest declares it."
        },
        "kind": { "enum": ["peerDependency", "dependency"] },
        "optional": { "type": "boolean" },
        "extra": {
          "type": "string",
          "pattern": "^[a-z0-9][a-z0-9-]*$",
          "description": "The Python extra that pulls this requirement in, when there is one."
        },
        "tested": { "$ref": "#/$defs/tested" }
      }
    },
    "package": {
      "type": "object",
      "additionalProperties": false,
      "required": [
        "id",
        "ecosystem",
        "name",
        "version",
        "channel",
        "prerelease",
        "gitTag",
        "sourcePath",
        "registryUrl",
        "runtime",
        "core",
        "hosts",
        "dependsOn"
      ],
      "properties": {
        "id": {
          "type": "string",
          "pattern": "^[a-z0-9][a-z0-9-]*$",
          "description": "Stable identifier: the package's git-tag prefix (RELEASING.md § Trains)."
        },
        "ecosystem": { "enum": ["npm", "pypi"] },
        "name": { "type": "string", "minLength": 1, "description": "The name on the ecosystem's registry." },
        "version": {
          "type": "string",
          "minLength": 1,
          "description": "The version the manifest declares. On main and release it is published (reconcile verifies it); on develop it may be bumped ahead of the next train."
        },
        "channel": {
          "type": "string",
          "pattern": "^[A-Za-z][0-9A-Za-z-]*$",
          "description": "npm: the dist-tag it publishes under. PyPI: latest for a final release, alpha, beta or rc for a pre-release, dev for a development release."
        },
        "prerelease": { "type": "boolean", "description": "True exactly when channel is not latest." },
        "gitTag": { "type": "string", "pattern": "^[a-z0-9][a-z0-9-]*@.+$" },
        "sourcePath": { "type": "string", "pattern": "^[A-Za-z0-9._/-]+$" },
        "registryUrl": { "type": "string", "pattern": "^https://(www\\.npmjs\\.com/package/|pypi\\.org/project/)" },
        "runtime": {
          "type": "object",
          "additionalProperties": false,
          "required": ["name", "range", "tested"],
          "properties": {
            "name": { "enum": ["node", "cpython"] },
            "range": { "type": "string", "minLength": 1 },
            "tested": {
              "description": "The runtime versions CI runs the suite on.",
              "type": "array",
              "minItems": 1,
              "items": { "type": "string", "minLength": 1 }
            }
          }
        },
        "core": {
          "description": "The Redact Secret core this package runs over (@redact-secret/core on npm, redact-secret on PyPI).",
          "allOf": [
            { "$ref": "#/$defs/requirement" },
            { "type": "object", "properties": { "name": { "enum": ["@redact-secret/core", "redact-secret"] } } }
          ]
        },
        "hosts": {
          "description": "Every other declared range CI qualifies: host SDKs and optional extras, sorted by name.",
          "type": "array",
          "items": { "$ref": "#/$defs/requirement" }
        },
        "dependsOn": {
          "description": "Runtime dependencies on other packages in this feed, with the declared range, sorted by name.",
          "type": "array",
          "items": {
            "type": "object",
            "additionalProperties": false,
            "required": ["name", "range"],
            "properties": {
              "name": { "type": "string", "minLength": 1 },
              "range": { "type": "string", "minLength": 1 }
            }
          }
        }
      }
    }
  }
}
